{
  "checked_at": "2026-05-22T14:22:56.579Z",
  "runtime_environment": "local",
  "schema_name": "public",
  "live_ingestion_enabled": false,
  "scheduled_monitoring_enabled": false,
  "network_execution_enabled": false,
  "public_note": "Metadata-only runtime health. No DB credentials, legal text, or secrets in this file. Live ingestion and scheduled monitoring remain disabled.",
  "status": "connected",
  "expected_tables_present": [
    "regulation_sources",
    "source_runs",
    "source_snapshots",
    "source_items",
    "detected_changes",
    "review_candidates",
    "runtime_events"
  ],
  "missing_tables": [],
  "runtime_event_count": 1,
  "latest_runtime_event_at": "2026-05-22T14:22:52.188Z"
}
